{
  "$schema": "https://json-schema.org/draft/2020-12/schema",
  "$id": "https://schemas.ecp-protocol.org/0.1.0/execution.schema.json",
  "title": "ECP Execution",
  "description": "Versioned execution record. Execution validity (VALID / INVALID / INCONCLUSIVE) is a distinct axis from task outcome (SUCCESS / FAIL): validity says whether a faithful, interpretable execution happened at all; outcome says how the task went. A SUCCESS or FAIL outcome is only expressible on a VALID execution. Raw output is preserved verbatim; no post-hoc correction.",
  "type": "object",
  "required": [
    "ecp_object",
    "execution_id",
    "evaluation_id",
    "system",
    "case",
    "runtime",
    "environment",
    "input",
    "raw_output",
    "model_access",
    "tool_access",
    "timestamps",
    "execution_status",
    "protocol_version",
    "schema_version"
  ],
  "properties": {
    "ecp_object": { "const": "execution" },
    "execution_id": {
      "type": "string",
      "pattern": "^ECP-EXEC-[A-Za-z0-9][A-Za-z0-9._:-]*$"
    },
    "evaluation_id": {
      "type": "string",
      "pattern": "^ECP-EVAL-[A-Za-z0-9][A-Za-z0-9._:-]*$"
    },
    "system": {
      "type": "object",
      "required": ["system_id", "system_version"],
      "properties": {
        "system_id": {
          "type": "string",
          "pattern": "^ECP-SYSTEM-[A-Za-z0-9][A-Za-z0-9._:-]*$"
        },
        "system_version": { "$ref": "#/$defs/semver" }
      },
      "additionalProperties": false
    },
    "case": {
      "type": "object",
      "required": ["case_id", "case_version"],
      "properties": {
        "case_id": {
          "type": "string",
          "pattern": "^ECP-CASE-[A-Za-z0-9][A-Za-z0-9._:-]*$"
        },
        "case_version": { "$ref": "#/$defs/semver" }
      },
      "additionalProperties": false
    },
    "runtime": {
      "type": "object",
      "required": ["runtime_id", "runtime_version"],
      "properties": {
        "runtime_id": { "type": "string", "minLength": 1 },
        "runtime_version": { "type": "string", "minLength": 1 },
        "description": { "type": "string" }
      },
      "additionalProperties": false
    },
    "environment": {
      "type": "object",
      "required": ["environment_id", "isolation", "network"],
      "properties": {
        "environment_id": { "type": "string", "minLength": 1 },
        "isolation": {
          "enum": ["none", "partial", "strict"],
          "description": "Declared isolation level of the execution environment."
        },
        "network": {
          "enum": ["enabled", "disabled", "controlled"]
        },
        "description": { "type": "string" }
      },
      "additionalProperties": false
    },
    "input": {
      "type": "object",
      "required": ["prompt"],
      "properties": {
        "prompt": {
          "type": "string",
          "description": "The exact input submitted to the system (verbatim)."
        },
        "attachments": {
          "type": "array",
          "items": {
            "type": "object",
            "required": ["name", "content"],
            "properties": {
              "name": { "type": "string", "minLength": 1 },
              "content": { "type": "string" }
            },
            "additionalProperties": false
          }
        }
      },
      "additionalProperties": false
    },
    "raw_output": {
      "type": "object",
      "required": ["content", "truncated"],
      "properties": {
        "content": {
          "type": "string",
          "description": "Raw output exactly as received - preserved without post-hoc correction."
        },
        "truncated": { "type": "boolean" },
        "finish_reason": { "type": "string" }
      },
      "additionalProperties": false
    },
    "model_access": {
      "type": "object",
      "required": ["access_path"],
      "properties": {
        "access_path": {
          "enum": ["direct-api", "local-runtime", "agent-framework", "undisclosed"]
        },
        "invocation_log_ref": {
          "type": "string",
          "description": "Reference to the invocation log artifact (evidence bundle)."
        }
      },
      "additionalProperties": false
    },
    "tool_access": {
      "type": "object",
      "required": ["tools_enabled", "tool_ids"],
      "properties": {
        "tools_enabled": { "type": "boolean" },
        "tool_ids": { "type": "array", "items": { "type": "string" } },
        "tool_log_ref": {
          "type": "string",
          "description": "Reference to the tool log artifact (evidence bundle)."
        }
      },
      "additionalProperties": false
    },
    "timestamps": {
      "type": "object",
      "required": ["submitted_at", "completed_at"],
      "properties": {
        "submitted_at": { "$ref": "#/$defs/iso8601_utc" },
        "completed_at": { "$ref": "#/$defs/iso8601_utc" }
      },
      "additionalProperties": false
    },
    "execution_status": {
      "type": "object",
      "required": ["validity", "outcome"],
      "properties": {
        "validity": {
          "enum": ["VALID", "INVALID", "INCONCLUSIVE"],
          "description": "Execution validity: did a faithful, interpretable execution occur?"
        },
        "outcome": {
          "enum": ["SUCCESS", "FAIL", "NOT_ASSESSED"],
          "description": "Task outcome. SUCCESS/FAIL only on VALID executions; NOT_ASSESSED marks pending or non-assessable outcomes."
        }
      },
      "additionalProperties": false
    },
    "anomaly_notes": {
      "type": "array",
      "items": { "type": "string" }
    },
    "protocol_version": { "$ref": "#/$defs/semver" },
    "schema_version": { "$ref": "#/$defs/semver" }
  },
  "additionalProperties": false,
  "allOf": [
    {
      "if": {
        "properties": {
          "execution_status": {
            "properties": { "outcome": { "enum": ["SUCCESS", "FAIL"] } }
          }
        }
      },
      "then": {
        "properties": {
          "execution_status": {
            "properties": { "validity": { "const": "VALID" } }
          }
        }
      }
    }
  ],
  "$defs": {
    "semver": {
      "type": "string",
      "pattern": "^(0|[1-9]\\d*)\\.(0|[1-9]\\d*)\\.(0|[1-9]\\d*)(?:-((?:0|[1-9]\\d*|\\d*[a-zA-Z-][0-9a-zA-Z-]*)(?:\\.(?:0|[1-9]\\d*|\\d*[a-zA-Z-][0-9a-zA-Z-]*))*))?(?:\\+([0-9a-zA-Z-]+(?:\\.[0-9a-zA-Z-]+)*))?$"
    },
    "iso8601_utc": {
      "type": "string",
      "pattern": "^\\d{4}-\\d{2}-\\d{2}T\\d{2}:\\d{2}:\\d{2}(\\.\\d+)?Z$"
    }
  }
}
